{
    "attr": "検査実施人数",
    "value": 72133,
    "children": [
        {
            "attr": "陽性患者数",
            "value": 3455,
            "children": [
                {
                    "attr": "入院中",
                    "value": 211,
                    "children": [
                        {
                            "attr": "軽症・中等症",
                            "value": 197
                        },
                        {
                            "attr": "重症",
                            "value": 14
                        }
                    ]
                },
                {
                    "attr": "宿泊療養",
                    "value": 34
                },
                {
                    "attr": "死亡",
                    "value": 67
                },
                {
                    "attr": "退院",
                    "value": 3143
                }
            ]
        }
    ],
    "last_update": "2020-11-07T00:00:00+09:00"
}